{
  "email_id": "email_480",
  "category": "BL_COMPARISON",
  "decided_by": "llm",
  "confidence": 1.0,
  "evidence": "The email explicitly asks to send the draft BL for MSDUL0942567993 for checking, which matches the rule that a request to send/check a named draft BL is BL_COMPARISON even with no attachments."
}