{
  "email_id": "email_466",
  "category": "SI_REQUEST",
  "decided_by": "llm",
  "confidence": 1.0,
  "evidence": "The email says 'Please find Shipping instruction for 5RAE-30524' and provides full SI details, then asks 'Please revert with draft BL once available,' which matches sending a Shipping Instruction rather than requesting a draft BL comparison now."
}