{
  "email_id": "email_257",
  "category": "SI_REQUEST",
  "decided_by": "llm",
  "confidence": 1.0,
  "evidence": "The subject and body explicitly state 'Please find Shipping instruction' and provide full SI details (POL, POD, shipper, consignee, goods, documents), with no draft BL attached; the request to revert with a draft BL is a follow-up, not a BL comparison."
}