{
  "email_id": "email_110",
  "category": "SI_REQUEST",
  "decided_by": "llm",
  "confidence": 1.0,
  "evidence": "The email says 'Please find Shipping instruction for 5RCY-51168' and provides full SI details, then asks to 'revert with draft BL once available', which matches sending a Shipping Instruction rather than requesting a BL comparison now."
}