{
  "email_id": "email_007",
  "category": "SI_REQUEST",
  "decided_by": "llm",
  "confidence": 1.0,
  "evidence": "Subject says 'REQUEST SI' and body says 'Please find Shipping instruction for 5RFR-37631' with full SI details (POL, POD, shipper, consignee, goods). It asks for draft BL later but no draft BL is attached, so it is not BL_COMPARISON."
}