{
  "email_id": "email_238",
  "category": "SI_REQUEST",
  "decided_by": "llm",
  "confidence": 0.85,
  "evidence": "Subject explicitly says 'Submit SI & AED' and the body asks the team to action outstanding BL items, indicating a request to submit pending Shipping Instructions rather than compare a draft BL."
}