{
  "email_id": "email_141",
  "category": "GENERAL",
  "decided_by": "llm",
  "confidence": 0.65,
  "evidence": "The email asks someone to send a draft BL for checking, but no SI or draft BL is attached, so it does not meet the BL_COMPARISON requirement; it is a general operational shipping documentation request."
}