{
  "email_id": "email_245",
  "category": "SI_REQUEST",
  "decided_by": "llm",
  "confidence": 1.0,
  "evidence": "The email says 'Please find Shipping instruction for 5RUS-39597' and provides full SI details, then only asks to 'revert with draft BL once available', which matches SI_REQUEST rather than BL_COMPARISON."
}