{
  "email_id": "email_181",
  "category": "SI_REQUEST",
  "decided_by": "llm",
  "confidence": 1.0,
  "evidence": "Subject says 'REQUEST SI' and the body explicitly provides/submits shipping instruction details for 5RAE-30107, including POL, POD, shipper, consignee, notify party, and cargo details. It asks for a draft BL later, but no draft BL is attached, so it is not BL_COMPARISON."
}