{
  "email_id": "email_505",
  "category": "GENERAL",
  "decided_by": "llm",
  "confidence": 0.5,
  "evidence": "The email asks to confirm the BL, but explicitly states the second attachment is a Certificate of Origin, not the draft BL, so no draft BL is available for comparison; it is an operational request rather than a BL/SI comparison."
}