{
  "email_id": "email_124",
  "category": "SI_REQUEST",
  "decided_by": "llm",
  "confidence": 1.0,
  "evidence": "The email provides Shipping Instruction details for 5ALT-28900 and says 'Please revert with draft BL once available', which is a future request rather than a request to check or compare a draft BL now."
}