{
  "email_id": "email_487",
  "category": "SI_REQUEST",
  "decided_by": "llm",
  "confidence": 0.85,
  "evidence": "The email provides shipping instruction details for 5RUS-40211 and asks for a draft BL once available, indicating submission of a new SI rather than comparison of an attached draft BL."
}