{
  "email_id": "email_323",
  "category": "GENERAL",
  "decided_by": "llm",
  "confidence": 1.0,
  "evidence": "Automated RPA notification stating a billing process completed successfully and no action is required, which is an internal operational update rather than a BL comparison, SI request, invoice query, or spam."
}