{
  "email_id": "email_093",
  "category": "SI_REQUEST",
  "decided_by": "llm",
  "confidence": 1.0,
  "evidence": "Subject says 'REQUEST SI' and body says 'Please find Shipping instruction for 5RSG-30068' with full SI details (POL, POD, shipper, consignee, goods, documents). No draft BL is attached, so it is not a BL comparison."
}