{
  "email_id": "email_456",
  "category": "GENERAL",
  "decided_by": "llm",
  "confidence": 0.65,
  "evidence": "The email asks someone to send a draft BL for checking, but no SI or draft BL is attached, so it is not BL_COMPARISON. It is an operational documentation request, best classified as GENERAL."
}