{
  "email_id": "email_380",
  "category": "SI_REQUEST",
  "decided_by": "llm",
  "confidence": 1.0,
  "evidence": "The subject and body explicitly provide a Shipping Instruction for 5RVN-75955, including POL, POD, shipper, consignee, goods, and document requirements, and ask for a draft BL once available rather than requesting a BL comparison."
}